{
  "schema_version": "1.0",
  "paper_id": "10.1038/s41586-019-1666-5",
  "source_sha256": "6f3030abb7d9d4f0624a5cbe5ca2ff673df63afc85c97fadd0bf7db780c8dbaf",
  "paper_characterization": "一篇实验物理学里程碑论文：在可编程超导处理器（Sycamore，53 个可用比特）上完成随机量子线路采样，把'量子采样之快'与'最先进经典超算复现同一分布之慢'并列，主张进入任务特定的量子霸权区间。它由一个可测标尺（F_XEB）、一台高保真仪器（Sycamore）、一条把不可算量换为可信估计量的替换链，以及经典代价外推共同构成。",
  "rationale": "本计划的节数、身份与顺序由这篇论文自身的论证逻辑决定，而非套用问题—差距—方法—实验—结果—局限的通用模板。论文的原生架构是一条'替换/验证梯'：先立起两个问题与任务，再用可测标尺 F_XEB 定义什么叫'跑对了'，然后打造仪器（Sycamore）并读取其误差，接着是可简化线路这一关键一跃（其有效性必须先在可模拟域被 Fig.4a 证实），之后才报出霸权读数，再用经典外推给出对位，最后借数字化误差模型说明信号为何不是伪的，并交代边界。若强行套用通用模板，最宝贵的一环'估计器有效性验证'与'实测/估计/外推三层分离'会被抹平，因此计划特意为二者各自留出专门章节。",
  "sections": [
    {
      "id": "S1",
      "title": "起点：两个问题与一个里程碑",
      "purpose": "以 Feynman 设想引出的两个问题立论，把'量子霸权'界定为面向特定任务的里程碑，并在一开始就埋下'非通用加速'的范围声明。",
      "proposition": "能否造出既够大、错误率又够低的量子系统，并配一个对经典难、对量子易的问题；本实验用一个基准任务同时回答二者。",
      "question": "这篇论文到底在证明什么，又在刻意不证明什么？",
      "evidence_refs": [
        "p.1"
      ],
      "source_anchors": [
        "p.1"
      ],
      "bindings": [],
      "argument_refs": [
        "N1"
      ]
    },
    {
      "id": "S2",
      "title": "选定任务与度量标尺",
      "purpose": "解释为何选随机线路采样（无结构、可借复杂度理论声称硬度），并说明关键困难：验证正确性的标尺 F_XEB 本身在最难线路上算不出来。",
      "proposition": "用线性交叉熵基准保真度 F_XEB=2^n⟨P(x_i)⟩_i−1 衡量处理器是否按理想量子线路工作；但计算 F_XEB 需经典模拟，进而在霸权区间不可用。",
      "question": "用什么标准判断处理器'跑对了'，而这个标准自身的极限是什么？",
      "evidence_refs": [
        "EQ-01",
        "p.2"
      ],
      "source_anchors": [
        "p.2"
      ],
      "bindings": [
        "EQ-01"
      ],
      "argument_refs": [
        "N2",
        "N3"
      ]
    },
    {
      "id": "S3",
      "title": "打造仪器：Sycamore 与高保真门",
      "purpose": "把处理器当作'测量仪器'来介绍：54 个 transmon、可调耦合、快速单/双比特门；要点是'多比特同时操作仍高保真'这一系统级主张。",
      "proposition": "Sycamore 的可编程二维阵列与快速高保真门，是后面所有读数的物理前提;关键进步是在真实计算、多门并行下仍保持高保真。",
      "question": "这台设备凭什么够格作为测量的仪器？",
      "evidence_refs": [
        "F01",
        "p.2"
      ],
      "source_anchors": [
        "p.2"
      ],
      "bindings": [
        "F01"
      ],
      "argument_refs": [
        "N4"
      ]
    },
    {
      "id": "S4",
      "title": "读取仪器误差：从逐项误差到乘法模型",
      "purpose": "给出孤立 vs 同时运行下的逐项误差率，并据此建立乘法保真度模型；同时明确指出该模型是一个'被支持但未被证明'的承载性假设。",
      "proposition": "把整条线路保真度建成各门/读出无误差概率之积（最大线路预测约 0.2%），其前提是放大规模不引入新误差源。",
      "question": "仪器自身的误差有多大，能否据此预测一次大计算的保真度？",
      "evidence_refs": [
        "F02",
        "p.3"
      ],
      "source_anchors": [
        "p.3"
      ],
      "bindings": [
        "F02"
      ],
      "argument_refs": [
        "N5",
        "N6"
      ]
    },
    {
      "id": "S5",
      "title": "关键一跃：让不可测者变得可测",
      "purpose": "承重章节：讲清 patch / elided / verification 三类简化如何把不可计算的 F_XEB 变成可估计量，并用 Fig.4a 在可模拟的 53 比特内证明 patch/elided 与完整线路吻合——这是从'估计'跨到'断言'的唯一凭证。",
      "proposition": "简化线路能把不可算的保真度估计出来；由于 patch/elided 在可模拟域内与完整线路一致，该估计可被许可地外推到霸权区间。",
      "question": "作者凭什么相信，一个被简化的估计量能代表真正跑不了的线路？",
      "evidence_refs": [
        "F04",
        "p.4",
        "p.5"
      ],
      "source_anchors": [
        "p.4",
        "p.5"
      ],
      "bindings": [
        "F04"
      ],
      "argument_refs": [
        "N7",
        "N8"
      ]
    },
    {
      "id": "S6",
      "title": "测量本身：霸权读数",
      "purpose": "报出对最难 tiling 线路的量子侧结果：n=53、m=20 的 elided 估计 F_XEB=(2.24±0.21)×10^-3，5σ 下平均保真度>0.1%，并说明完整线路数据被归档而未验证。",
      "proposition": "在经典无法直接模拟的区间，处理器采样得到的 F_XEB 显著高于均匀噪声，构成'已进入霸权区间'的量子侧证据。",
      "question": "在最难的线路上，量子处理器实测/估计到的保真度是多少？",
      "evidence_refs": [
        "EQ-07",
        "F04",
        "p.4"
      ],
      "source_anchors": [
        "p.4",
        "p.5"
      ],
      "bindings": [
        "EQ-07",
        "F04"
      ],
      "argument_refs": [
        "N9"
      ]
    },
    {
      "id": "S7",
      "title": "对位：经典代价的外推",
      "purpose": "给出经典侧的对称数字：Schrödinger 全态到 n≤43、其外 Schrödinger–Feynman 混合算法，按 F_XEB 缩放外推出同等保真下的经典代价（约 50 万亿核小时/一万年级），与 Sycamore 的 200 秒（净约 30 秒）对置；明确这是外推而非直接计时。",
      "proposition": "在同等保真水平上，经典超算复现同一分布被估计为约一万年，而量子处理器约 200 秒;次对比是'量子霸权'一词的来源。",
      "question": "'一万年对200秒'这个最抓眼球的数字是怎么来的，有多稳？",
      "evidence_refs": [
        "F04",
        "p.4",
        "p.5"
      ],
      "source_anchors": [
        "p.4",
        "p.5"
      ],
      "bindings": [
        "F04"
      ],
      "argument_refs": [
        "N10"
      ]
    },
    {
      "id": "S8",
      "title": "为何不是伪信号：数字化误差模型与可证伪性",
      "purpose": "讲清因果机制（干涉+斑纹分布+高保真保留+计算体量）与数字化 Pauli 误差模型如何使乘法预测成立，并给出证伪条件：若 F_XEB 比预测衰减更快或经典算法追上成本，主张即告失败。",
      "proposition": "系统保真度能被'单项门保真度相乘'预测，支持误差是局域 Pauli 的数字化模型;这正是信号真实、且可被进一步检验的原因。",
      "question": "这个信号凭什么是真的，而不是相关性噪声或经典模拟的巧合？",
      "evidence_refs": [
        "F04",
        "F02",
        "p.5"
      ],
      "source_anchors": [
        "p.5"
      ],
      "bindings": [
        "F04"
      ],
      "argument_refs": [
        "N11"
      ]
    },
    {
      "id": "S9",
      "title": "边界与未决：它证明了什么、没证明什么",
      "purpose": "交代任务特定性（仅对 RCS）、NISQ 与未容错、可证明随机数等近期用途、对扩展 Church–Turing thesis 的哲学性外推，并保留修订备忘中的三项未决（经典成本稳健性、Paululi 模型有效域、端到端可复核性）。",
      "proposition": "这是里程碑式、任务特定的加速，而非通用量子计算的开端；其最强数字与若干根本假设仍有未被完全封闭的开放缺口。",
      "question": "读者应当把'量子霸权'理解成什么，哪些部分仍未定论？",
      "evidence_refs": [
        "p.1",
        "p.5",
        "p.6"
      ],
      "source_anchors": [
        "p.1",
        "p.5",
        "p.6"
      ],
      "bindings": [],
      "argument_refs": [
        "N12"
      ]
    }
  ],
  "uncertainties": [
    "经典>一万年估计的稳健性未经量化，只知方向（成本会降、被硬件甩开）。",
    "数字化 Pauli 误差模型有效域的上界未被证明；相关性误差何时破坏乘法预测是开放问题。",
    "完整最强线路数据归档未验证，霸权读数的保真度无法被独立重算。",
    "F_XEB 在霸权区间是估计量；全稿须始终区分实测、受担保估计与外推三类证据。"
  ]
}
